"549","Much none adult","140.87","true","clothes","Street sort still difficult environmental defense control push star suggest","69","80"
"550","Their already technology matter herself","223.40","true","appliances","Five system leg use despite begin writer whom enjoy once seat side thus final eye raise","3","18"
"551","Provide central reduce security factor","469.54","true","food","Anyone catch before poor speak effect adult sport","88","3"
"552","Per stuff company national serve","343.19","true","food","Agree find important into relate property baby","28","6"
"553","Series live tend","232.21","false","random","Best mother similar girl receive bed least","73","64"
"554","Avoid center front seem serve","25.79","true","appliances","Their effort subject science growth air seem but table on Congress phone personal only","72","18"
"555","Million summer way","403.36","true","random","Appear floor daughter summer same simply question good morning leave","29","79"
"556","Here question reflect","378.95","true","clothes","System you wish toward government energy sport mouth huge develop","57","85"
"557","House way member begin","64.07","false","sports","Conference inside bank most animal movement charge staff reason","94","70"
"558","Response task","179.01","true","sports","Congress receive ever kitchen participant expert administration not call","52","89"
"559","When system the sister","492.94","false","food","National resource black four start machine manage because down save common work between reach","30","13"
"560","Personal heart easy least seek","342.72","true","food","Job radio body however meet international operation","8","91"
"561","Long several style","262.39","false","appliances","Later point wish game fall such material break southern Republican into present suffer","16","87"
"562","Responsibility likely official","384.50","false","food","Push above several turn idea man thank ever market full field least","65","81"
"563","More training girl adult","239.63","false","appliances","Natural small direction life scene exist team think culture success","15","65"
"564","Among PM","86.67","false","random","Lot it sort fall camera situation enter simple finally hold social","76","51"
"565","She hear company artist free","207.03","true","appliances","Include despite wind citizen wait fly themselves sometimes","30","81"
"566","Ready management appear up","59.68","false","random","Full talk service industry realize southern material","97","41"
"567","Natural cultural","112.80","true","clothes","History hot night almost ago I others next first process summer natural","67","80"
"568","Live movie","353.74","true","sports","Me different find small nothing camera crime business show main raise commercial","26","89"
"569","Federal modern reduce","306.58","true","appliances","Stay four technology our their camera either pretty maintain child computer measure for","31","51"
"570","If piece part","203.20","true","sports","Morning push tough population develop question human physical staff","52","55"
"571","Quality think model difficult","304.45","true","appliances","Though recent yeah cup draw article apply attention","76","53"
"572","Throughout authority election data","240.90","true","appliances","Executive article as across him condition degree standard realize lay","32","64"
"573","Break magazine","460.19","false","clothes","One I plan amount include enough card seven","45","61"
"574","Challenge true","77.47","false","food","Several game of drive might employee ever teach as table put central upon skill","4","82"
"575","Bed small name","341.27","true","clothes","Discover PM growth big create population stand reason control exactly age movement break even both social","86","41"
"576","Whose fact picture hold","404.28","false","appliances","Father family her marriage fight make enjoy concern rest magazine save","74","91"
"577","Whom season","430.24","false","random","View mouth change other left build once day cost fight","63","10"
"578","Amount build region various","222.48","true","food","Story send pattern establish picture artist low admit cold surface fill wall","54","13"
"579","Better happy phone we","213.26","true","random","Human risk price successful federal summer take fine blue total type carry","3","41"
"580","Natural computer various threat","114.22","true","appliances","These health audience station whose card carry girl use must","76","28"
"581","Station peace goal","444.70","false","random","Start bed choose move use consumer similar dark claim","18","42"
"582","Popular push four","481.33","false","sports","Generation all school whom paper open media claim animal short lose answer","17","2"
"583","Service tax customer","114.98","false","clothes","How material tell then interest add nor scientist former point support attorney similar toward","32","84"
"584","Since process above","318.51","false","clothes","Who general there sister somebody training cell situation religious eat","8","65"
"585","Among onto resource","448.55","false","random","Health Democrat lay city painting probably food agency tell hard store","15","72"
"586","Specific member red","14.06","false","random","Lose run reality until item throw we chance billion should gas bring role official memory","32","6"
"587","Yourself fast court seat blood","438.19","true","appliances","Girl property month lot bill perhaps production financial clear","35","65"
"588","Charge national mother long","384.45","true","random","Consumer with maintain sign think travel organization window generation sometimes others million","40","10"
"589","Nearly style common safe operation","1.15","true","appliances","Music tough pass night born evening series right interview be decide second control security","31","61"
"590","And kid young","449.35","false","clothes","Police military offer exist threat peace page police sister may people staff structure","22","41"
"591","Also game head she","372.42","false","appliances","Send budget nearly most war both edge whatever according none event house entire ahead seat sign","44","51"
"592","Suggest possible claim send seven","140.05","false","appliances","Show forward outside show care information dark seek","95","80"
"593","Push season military","349.67","false","random","Story us during high catch strong area cultural couple their","40","91"
"594","Mission nature speak skill piece","206.07","false","sports","Pick voice Democrat pattern speak about American ready area specific over word","76","12"
"595","Herself wide once","198.48","true","sports","Prove sister couple need world actually food land level","13","82"
"596","Floor range could","270.03","true","sports","Note position see born throw before since","48","21"
"597","Daughter thank all production city","216.68","false","random","Interest include article form buy scene responsibility range factor itself address safe","88","63"
"598","Exist area term him success","271.82","false","food","Say establish forget position western share site population prepare","86","6"
"599","Term kid picture particularly","63.62","false","random","Rich follow idea onto none phone no concern me avoid citizen","43","80"
"600","Design likely clearly","231.40","false","clothes","Friend agree or crime own PM anyone account hand whether","65","77"
"601","Old decide","298.85","false","appliances","Teach apply book they law spring thus animal although whose huge travel family break total","64","51"
"602","View whose which","26.36","true","random","Century deep bar these establish senior build without herself defense order occur go scientist","52","63"
"603","For form","176.62","true","random","Mission success wrong skin technology reality physical gun first customer then although rock","10","25"
"604","Music investment","131.47","true","random","By strong candidate president notice local perform benefit","42","25"
"605","Then among easy center","114.20","false","random","Level article ball test candidate instead tree recent speech","39","34"
"606","Money guy never stop benefit","195.61","true","sports","Teach beautiful manager peace professional interest provide commercial class feel","44","59"
"607","True future various debate current","398.23","false","clothes","Animal when scene ago under reflect usually system cultural trial possible necessary rule stay argue to","77","57"
"608","Get first single agreement","283.69","true","random","Tonight lawyer her number administration collection recent example month most","72","56"
"609","Bring art performance artist","463.57","true","appliances","Poor yeah research who take office heart while voice might","9","64"
"610","Without possible once plant","309.41","false","appliances","Opportunity evidence letter or black trial value moment human whatever product of","10","28"
"611","Hand allow report","142.15","true","appliances","Treat real training remember doctor mind station hot carry she your into throw recent most score","71","91"
"612","Old despite see","253.28","true","clothes","Billion matter within party early their physical turn worker land happen","49","20"
"613","Capital short human difference","7.26","false","clothes","Positive nor seek nor kid send create focus hear center over various age standard","18","65"
"614","Will yard structure most","240.93","false","random","Generation want image score relate care natural behavior fire present factor article heavy civil first","46","72"
"615","Painting key network","272.10","false","sports","Art under line skill ahead war while","48","17"
"616","Need situation wonder","139.36","false","random","Hotel major forget whether bring couple put will firm","97","34"
"617","Simply that thank","9.71","false","clothes","Wide piece reflect herself foreign begin forward party reality open my","56","40"
"618","Perhaps other seven","352.67","true","sports","Raise according evidence wide rather president exist arrive two force seem make long best pick","36","28"
"619","Manager machine Republican type","48.06","true","food","Take rest Mrs season sign lose change according none","65","68"
"620","Rock identify","496.90","false","random","Choose action care effort anything example upon course minute","6","27"
"621","Shoulder election lose shoulder","104.34","true","sports","Mr station official major begin since room strong policy record claim spring or occur race indeed","48","97"
"622","Later dog former common","232.29","false","random","Which spring quality cell lot notice quality many score building politics Congress whom guy until","62","61"
"623","Know few cell","433.39","true","random","Interesting read once mission both single say worry second less stop not apply argue","72","30"
"624","Great especially","302.02","false","appliances","Health mean meet wind floor expert letter rock process many","20","51"
"625","Senior consumer ready artist","30.57","true","appliances","Job wish federal clearly close until value result time reason model government five","1","80"
"626","Day leg some market","36.72","true","clothes","Various consider reduce perform language though expect professor it station huge more many box so","68","28"
"627","Bring discuss from night","168.42","false","appliances","First democratic officer direction like team member necessary son boy management way others final","58","58"
"628","Discuss serve popular recognize notice","51.46","false","clothes","Capital hour from forget view between wall carry head worker hope until partner about necessary instead","58","69"
"629","Word people join produce or","300.45","true","sports","Pass movie those performance mean professional health measure loss share process want may","45","61"
"630","Executive ago everything","479.80","false","sports","First step enough dream open prevent here","92","80"
"631","Film first head","125.83","false","random","Yourself morning significant safe sing ahead letter fight father","69","55"
"632","Line modern school","213.57","true","random","Set time expect situation quickly quickly experience believe tend should","90","20"
"633","Present talk field style","472.58","false","random","Teach anyone operation history adult including ok current should yourself","81","42"
"634","Hand spend despite serve including","272.24","false","appliances","Network form visit low employee claim level story call unit cover worry","44","56"
"635","Outside result memory","336.00","true","random","Feeling fund quite four culture watch common thing mouth simply these pick","99","4"
"636","They strategy test poor","51.70","true","appliances","Avoid wear audience voice generation most rich","71","25"
"637","Suffer age","381.64","false","food","Short also expect leave yourself might discover read look attack dog rise sea happen","97","36"
"638","Word west against public","88.11","true","food","Recent new enter only physical each fish pressure executive west husband range stuff learn ground subject","26","55"
"639","Project crime next right system","323.56","true","food","Body argue lose lose building next how evening word","89","51"
"640","Sea technology thus may","223.25","false","random","Because natural social agreement black election too without close you change affect","82","8"
"641","There quickly president low","87.72","false","random","Girl table organization democratic late say by east four model quickly current final ask music","33","97"
"642","Song example dark","354.82","false","food","Very health behind already way big yeah","90","66"
"643","Claim to social","463.82","false","sports","Carry guess society appear low consumer close point those order thing that job","16","18"
"644","Place study sea actually gas","245.37","true","food","Sit much foot production card church actually ball off like determine","72","20"
"645","We professor year","416.98","true","random","Drive inside project civil one reach evidence","36","57"
"646","Mother drug attorney project Republican","144.06","true","appliances","My whom daughter second decade record campaign her base","31","59"
"647","Short class activity fire","363.11","false","clothes","Future collection beyond anything over cultural direction point respond everything half police sell","77","94"
"648","Magazine myself hotel weight","33.43","false","clothes","Remain free successful yet help still nor","26","3"
"649","Do bed right adult","139.43","true","clothes","Simply us sister speak range dinner message next people always","20","58"
"650","Out claim politics benefit international","267.59","true","clothes","Property see use take bank for scientist source base machine","36","50"
"651","Hold act career","96.94","true","random","Former network senior list rather defense well personal decade manager their before","65","41"
"652","Involve agent former area four","115.74","false","appliances","Attack later look bank American decade six conference business fill network management choose lose suggest staff","81","53"
"653","She despite","197.32","true","appliances","Section with bring maintain south wait my notice until hour","93","25"
"654","Agent article","253.98","true","appliances","Reason middle difference put general ready southern save young land grow remember stock team over market","70","72"
"655","Participant take","220.05","false","appliances","Best reveal expert fear throughout once talk such product coach floor effect wonder cultural school","89","80"
"656","Tell media","436.31","true","random","Former hour me produce area security speech property reveal star","69","6"
"657","According practice","240.52","false","appliances","Whether prove bring dream trial age movement push movie which game movie loss glass","19","25"
"658","Sort forget chair candidate","188.17","false","clothes","Crime now fill manage consider she well stop dog","15","28"
"659","Consumer exactly affect news down","196.65","false","sports","Thank coach federal catch ago activity happy scientist save dog center that federal interest","54","23"
"660","Tell great","190.49","false","clothes","Film scene lay thought Mr southern natural six","40","89"
"661","Model little crime","188.46","true","food","Room leader sell by majority guy huge","74","66"
"662","After quality agency attack","189.73","true","clothes","Laugh world question agreement network hospital growth more respond seven bed enter answer research pick","71","21"
"663","Until area policy yard","47.47","true","sports","Herself support impact note eat hotel contain become add everybody","10","23"
"664","Management realize commercial","95.96","false","food","Else itself smile fine forward study south all wonder campaign","73","69"
"665","Information here performance fast pressure","415.25","true","clothes","Example seek chair unit right write product huge than admit","71","49"
"666","Him from tonight phone short","267.30","false","sports","Kid lot Mr film wife huge successful western together","11","4"
"667","Media wish","315.81","true","clothes","Or keep difficult which air get outside land certainly deep may","80","80"
"668","Activity contain investment character","290.59","true","appliances","Between less significant step skill management grow difficult Republican","26","17"
"669","Job wonder","170.65","false","appliances","Citizen record short according response reason form support enjoy laugh organization election vote development","45","30"
"670","He yes","185.96","false","random","Send money its lawyer which matter including tend","25","29"
"671","Part Congress institution include political","240.16","false","food","Almost capital military PM road determine total sound after movie beyond rather your herself number","69","36"
"672","Eight ready but how discussion","379.10","true","food","House when month run suddenly since spring leader religious head teach enough population success country","88","49"
"673","Not yeah wall discuss","382.42","false","appliances","Provide itself factor mention those policy strategy number phone wonder believe activity example","98","58"
"674","Nice board change because though","258.93","true","clothes","Fly sign else rich often rate decide","65","18"
"675","Table piece open try","212.54","false","clothes","Current picture act case development environment red all clear according from whose no dinner available data","22","28"
"676","Result unit story","6.67","true","clothes","Live choice action side per use party true lose ten firm nor away training require","95","82"
"677","Simply child play approach","60.48","false","sports","Name month democratic different reality start chair impact none","96","6"
"678","Part letter share walk such","499.11","true","random","Themselves already system argue affect American future right defense onto dog them something be than","97","56"
"679","Across consumer","233.86","false","sports","My teach economic chair really worker ask often western performance","97","50"
"680","Season speak born nation","389.72","true","sports","Key whom remain mother town key media","36","82"
"681","Red beautiful employee become","16.57","true","food","Indicate support century well young people like federal carry","64","71"
"682","Short less society involve young","293.53","true","clothes","Word ago leg great industry pick watch try couple he run gas whatever far","49","48"
"683","High stock husband thank","345.62","true","appliances","Study here him our pattern which decade run half enter","28","53"
"684","Reason task data option","304.12","false","food","Baby our price turn others their situation particular our yard authority","51","28"
"685","Name building participant rock PM","420.46","true","appliances","Sit organization choice lot really challenge per just lead American hit toward people Republican describe","72","4"
"686","Bad girl science","408.16","false","sports","Perhaps impact message instead hair north artist street movement defense","100","55"
"687","Trade friend office carry","66.56","false","random","Which west play wonder seek grow current white class speak light against more magazine magazine sister","77","45"
"688","Performance let brother very","45.46","false","appliances","Again begin soldier with current TV own mean","15","50"
"689","Really teach room","241.01","false","appliances","As probably surface third south plant or sort prove per","13","63"
"690","Us discuss","216.18","false","sports","Reality fight forget person everything former describe treat share for","57","72"
"691","Make easy yard","291.25","true","sports","Better successful organization beat clear where final may","13","25"
"692","Front perhaps look","78.11","false","sports","Although long long fill check dark quite senior attack class class treatment morning front let","83","10"
"693","Pay action ever candidate","413.04","false","random","You tax real weight throughout able successful culture example","97","6"
"694","Heavy entire instead","208.98","true","food","According tree mother very when world just mention continue happy read none","95","66"
"695","Rule education writer region herself","168.86","false","random","Worry can analysis our during individual ever","83","34"
"696","Free assume where five","397.78","false","appliances","Economy gun back spring single far themselves final director chance wait while national road of","7","56"
"697","Arm fast source","70.00","true","random","Some significant may claim simple hair theory line","92","8"
"698","Past fire service Republican design","315.28","true","random","Suggest suffer letter third soon form politics","69","81"
"699","Rock court trade","221.63","true","sports","Cause success community give week green standard might officer enter somebody short meet condition prove","81","41"
"700","Something authority","403.38","false","appliances","Build million fill individual hospital middle wonder price strategy research international now page kind religious production","41","35"
"701","Way environmental mouth so","458.51","false","appliances","Through building Congress fund affect report test close chair everything protect safe current build man","71","6"
"702","Determine red who","417.53","true","random","Computer relate stay alone discussion score Mr","98","94"
"703","Close lead may friend strong","475.18","false","appliances","Place break name during somebody page official TV stuff work nice police","52","8"
"704","Sit age realize research","274.68","true","clothes","Inside other least order miss why say outside","15","79"
"705","Win those young","427.11","false","random","Send apply guess former hotel build long station friend something share onto name","6","42"
"706","Common shake center suddenly learn","173.50","false","sports","Run might ground many indicate girl general word girl development","67","91"
"707","Tax about option","287.68","false","random","Billion scientist others would stand organization will well war local forward","58","61"
"708","Woman beautiful top ball","336.45","false","food","Hundred season economy professor ground debate animal area pass end building","98","42"
"709","Method behind per arrive","256.35","false","appliances","Relate really plan age accept form performance","33","13"
"710","Mind either room kind","208.51","false","sports","Media design too teach coach ago common plan site career meet raise act me","64","80"
"711","Mean collection","164.95","false","clothes","Tend service we there off wear though work strategy","81","17"
"712","Girl beyond deal","463.79","true","appliances","Believe because wear prevent cold staff radio either agreement","1","82"
"713","Such dream create offer wonder","442.00","false","sports","Type within entire since cover early carry indeed out consumer for","17","10"
"714","Write language member","333.32","false","food","Theory international read safe money into single pressure spring traditional discuss something seek another week close","31","13"
"715","Future road election first with","245.02","false","random","Still water allow theory cell government break medical","86","35"
"716","Protect well office wonder follow","370.17","true","appliances","Expect person court range us season great","84","66"
"717","Continue there example everybody","71.78","false","sports","Total meet for again article rate yes perhaps protect","70","56"
"718","Charge occur TV how","448.05","true","clothes","Enjoy tell appear contain ability against low people interesting throw","17","64"
"719","President perform partner within suffer","325.43","true","food","Short treat and civil voice treat ask stand development because operation picture two resource","92","49"
"720","Around reason","71.88","false","sports","Glass push system technology point provide walk mind culture","35","53"
"721","Person ok","282.12","true","appliances","Beautiful last go whose chance add do time site modern west late sense","44","65"
"722","Crime majority different customer sit","473.27","false","clothes","This agent account stage improve deal couple character customer hour return concern","25","87"
"723","Buy always friend","490.27","true","clothes","Old any always purpose I read big","61","91"
"724","Leader take leader","137.27","true","sports","Relate his four name career find page machine pretty","41","69"
"725","Stop ok history","263.73","true","clothes","Worry ago speech none remember worry capital arrive radio","45","57"
"726","Behind require enter","238.87","false","random","Despite pass that which deal test prepare stand director outside food campaign individual number type","97","68"
"727","Mission past exactly near would","461.49","false","food","Third project evidence late tough tell hear create mouth","25","33"
"728","Everything group for message","81.87","false","sports","Account crime fund face fly behavior prove such","87","25"
"729","Health shoulder decade order or","323.98","false","random","Perform hear Congress hear work instead herself someone employee tend","83","30"
"730","Politics past long","471.61","false","food","Trip Mr information carry drug these size significant then receive want","56","13"
