"1090","Factor hair","61.09","false","appliances","Professional employee bag hear door still whose test market hear decide provide participant impact","33","66"
"1091","Keep hotel together","139.81","false","sports","Idea food knowledge sound become without still pull former west sell base forget","88","49"
"1092","Condition career read box","123.16","false","clothes","Hard teacher example federal Mr consider federal open fly dream draw for decade eye feel","48","48"
"1093","Would media","153.53","false","food","Believe seek husband minute fact everyone save during","99","33"
"1094","Actually base cup","144.10","true","appliances","Money subject former line yeah new land space side easy industry their","89","42"
"1095","Skill heavy","407.62","true","appliances","Activity parent large voice occur seven become story marriage others chance","40","84"
"1096","International message theory care five","374.56","true","appliances","Whether vote worker ability newspaper by price practice today performance thus physical language company against","90","12"
"1097","Upon heavy purpose","238.38","false","appliances","Trial pull trade save little possible rather wear us whole ok behavior skin discover discover","72","8"
"1098","Republican build woman base","136.14","true","clothes","Against head message price standard recognize compare analysis wait nature cut song he","90","78"
"1099","Thing little recently allow simple","14.41","false","clothes","Professor will charge night myself realize area","1","25"
"1100","Above front three evidence","413.63","true","appliances","Open education center nothing partner opportunity really raise watch war","50","57"
"1101","South table memory series foreign","115.95","true","food","This everyone note save his lawyer member","93","59"
"1102","Chair may nation","169.86","true","food","Star beyond too recognize last others four magazine employee character over stand radio player other stay","30","28"
"1103","Another Congress","207.36","false","random","Consider white carry despite pay water character","93","81"
"1104","Cell box skin","122.41","false","random","Get likely job beautiful above question thought fine price long believe attack successful me team","19","72"
"1105","Security happy this","112.30","false","appliances","Material develop authority among reflect soon baby yes","13","50"
"1106","Whatever amount","415.50","false","clothes","History color heart ask science interview fast station common","98","33"
"1107","Notice American able friend","95.76","true","appliances","Economic state most experience design allow visit region agent allow","93","55"
"1108","Morning suffer play","317.35","true","random","Pass particularly rule receive hope huge simple statement group safe process artist appear organization out themselves","82","55"
"1109","Stop crime phone civil","23.82","true","appliances","Its actually include less professional concern little population hospital able computer son degree avoid","43","85"
"1110","Choose around nature","339.43","false","food","Generation two good wish behind yard owner","38","68"
"1111","Positive camera","230.58","true","food","This culture very I knowledge policy tonight general store","33","80"
"1112","Ground relate address","434.36","true","appliances","Effort reach right nothing trip phone play place common vote away","18","65"
"1113","Building dog best conference","315.51","true","random","Public fast light what record well discover pretty court since phone clearly worker participant indeed plan","67","53"
"1114","Others ago that indicate","18.87","true","random","Quickly issue produce no million school style list figure test conference bar blood everything","31","71"
"1115","Watch whose upon understand method","61.22","false","food","His well civil she left prove pick series","38","25"
"1116","One catch president respond","442.20","false","random","May page media camera if left boy picture face page author become number catch not","26","69"
"1117","Include game market","319.70","true","appliances","Result hit building get part cause conference although score cultural room meet","83","25"
"1118","Hot cover discussion","337.66","false","clothes","Again suggest challenge consider live miss may evidence","79","34"
"1119","Live leader note if","462.39","false","random","Century laugh develop owner face front collection help society trip mention my newspaper","83","72"
"1120","So model way","328.48","true","sports","Hospital enjoy truth her whom close compare establish senior","60","18"
"1121","Must paper control","170.57","false","clothes","Opportunity city good Democrat energy before door debate myself indeed likely especially under","14","36"
"1122","Impact five","344.75","false","random","Score manage Mrs foot past bank dinner federal","84","42"
"1123","Necessary general lawyer well whether","291.48","true","food","Him east dark authority learn apply local sell shoulder necessary authority black","93","56"
"1124","Student military success","315.26","true","random","Sea three anyone old mouth next serious myself city reveal kind join","23","42"
"1125","Stay maintain low","113.14","true","appliances","Community difficult position safe expert recognize bring power example trip price Mr perform thus","47","50"
"1126","History music plant conference","496.03","false","random","Career beautiful history store natural system let growth difference view crime to boy child moment","24","53"
"1127","Four worry","132.53","false","clothes","Opportunity a return church rise deal cultural into activity use","67","53"
"1128","Have find","470.22","false","food","True oil quickly miss simple meeting return task","70","94"
"1129","Place run fight performance fish","422.22","false","random","Although even board training thank message name","42","58"
"1130","White green research face something","65.84","true","random","Large card race black idea finally service whatever again none girl final popular rise response water","89","80"
"1131","Material center effect","111.87","false","appliances","Herself relationship specific tax main community spend fast debate","1","23"
"1132","Simple maybe program","363.31","false","random","Else message account product sing call good let","16","55"
"1133","Social ask voice respond","331.74","true","food","Process thousand behavior across fly today whose total","87","42"
"1134","We ability once","432.07","false","random","Own themselves smile bad play difficult enjoy like market case north not","45","18"
"1135","Lot card hot","440.49","true","clothes","Kitchen fund send professional back Democrat simple any become wall school","67","25"
"1136","Responsibility out most","410.80","false","appliances","Set line trial house result site memory the training","20","56"
"1137","Fine evening believe","349.73","false","random","Worker eye start everything play particular street","83","48"
"1138","Before lose attention","68.01","true","appliances","Man remain Mr attack many interest never quality heavy guy among","60","81"
"1139","Cell security make budget six","403.06","false","random","Painting dog another situation majority air kid sometimes nature social human account","25","3"
"1140","Law my guy","106.11","false","clothes","Grow gas certainly itself or add front Mr smile peace central run exactly","21","33"
"1141","Level doctor stock least prepare","308.80","true","random","Own society everything read list store top phone","17","87"
"1142","Field loss figure lawyer","33.60","false","appliances","Claim manager lead movement she seem activity program around risk discover if camera","36","3"
"1143","Find claim figure","132.43","false","appliances","Up far consumer along memory worry money rich field century star than in mention anyone","92","45"
"1144","To road person","438.56","true","clothes","Compare term positive station conference thing behind","28","8"
"1145","Character high","58.27","true","food","Affect father chance great remember as present","24","4"
"1146","Shake southern budget control","108.25","false","sports","Pull anyone task win cause describe soldier paper add very consumer training","47","97"
"1147","With manager some phone","147.68","true","sports","But voice after clear list along people early","86","30"
"1148","Near trial well court yet","68.72","true","food","His start growth system rock deal our government her career bit","33","78"
"1149","Military protect resource use property","167.59","false","clothes","Stop voice senior space up hit pass indeed gun","8","6"
"1150","Training meeting future report","46.86","true","random","Beyond share last woman once dream serious buy involve fish tell child","75","72"
"1151","Society former same","446.48","true","sports","Material sit left argue set between Democrat human source discussion audience safe","68","12"
"1152","Compare real human animal position","440.84","true","food","Forward wish knowledge keep sure boy position mean fear line","75","6"
"1153","May technology like pressure lose","367.49","true","clothes","Stop million behind may affect often this read foot sport past street plant charge","34","34"
"1154","Fear fall forward","366.55","false","sports","Building investment open line life receive long research almost score perhaps","68","40"
"1155","Way American action","58.50","true","clothes","Chance agent hour and glass local current fall senior citizen land group treat","83","18"
"1156","Call both green black","360.82","true","food","She TV but exactly recognize drop month several use personal tend responsibility collection place","56","87"
"1157","Professional modern","113.39","true","sports","Within large still either door control agency break interview federal price what","17","84"
"1158","About feeling past manager","224.15","false","random","Long still data debate seek type most per class hear add loss old","64","49"
"1159","Military remain","384.41","false","food","Economy size experience feeling available lay truth reality government among and","41","12"
"1160","After another wife worker","325.36","false","appliances","Material talk various involve cover day guess little later night","42","4"
"1161","Speech design","284.36","true","random","West its chair describe church mention affect end","97","55"
"1162","Agree five","370.58","false","sports","Pass author onto end view produce country off mind yet certainly turn","19","17"
"1163","Hundred song focus scene dark","264.18","true","food","Difference act indeed brother involve air commercial tell current yard deep teach","1","30"
"1164","Forget new coach","413.71","true","clothes","World fire require full easy nor already research sea local","3","45"
"1165","Season amount question decide","204.38","false","sports","Hand over sense admit tend animal discover act","92","71"
"1166","Could trip century particularly whole","405.48","false","random","Sort worry alone exactly amount simple guess everybody traditional total business fact blue sometimes as morning","37","87"
"1167","Participant social mission people form","171.18","true","random","Mind break night result design end smile house whether young everyone consider","59","87"
"1168","Show money item would","182.67","false","appliances","Language least list us tend seem practice down new cause could","90","35"
"1169","Late young","296.42","true","appliances","Meet base leg case show interesting wind run within air","45","80"
"1170","Difference me end sometimes","405.42","false","random","Under of meet bar raise sit artist report space treatment result say","14","78"
"1171","Service food father type want","123.27","true","random","She television these general today choose board development raise civil brother impact beyond","18","83"
"1172","Simply common","84.85","true","random","Phone institution Congress certainly morning board pattern myself glass","61","55"
"1173","Behind save person","336.61","true","appliances","Common gas appear with factor word activity grow score","83","69"
"1174","Land adult Mrs","101.51","false","random","Sea control cost authority various young make think","27","57"
"1175","Time feeling six back","454.29","true","food","Professor control ago tonight participant break light cold impact option sport buy brother","48","65"
"1176","Worry result through might build","30.27","false","food","Explain class such law listen floor parent sign wait you early green attack","19","55"
"1177","Specific base authority if","232.76","false","random","Deep window those sense right test senior public work ahead behind","38","78"
"1178","Place party","468.27","false","clothes","Finish back media safe fall well what such","23","70"
"1179","Great security man figure","383.69","false","food","Military scientist movement free should any population customer thing heart family security unit form","41","42"
"1180","Whom skill ok thought","172.78","false","random","Response should defense receive development political sometimes reduce past result turn stop view tree line view","14","53"
"1181","Onto family","33.50","true","random","Sense product cultural alone forget despite statement tell particular decade table","31","4"
"1182","Size organization vote","199.55","false","sports","Head necessary guess attack material view hit cell must scientist brother serve go","5","13"
"1183","Air sort color","393.55","true","clothes","Rest meeting strong affect spring day lose those Mrs we play act character student road air","50","4"
"1184","That economy","432.72","true","sports","Behavior stop page drop sister white nation","26","12"
"1185","Him skill","479.71","true","random","Represent follow hope result beautiful sometimes table thus statement answer","56","61"
"1186","Successful lawyer word reality","263.54","true","random","Western particular weight style defense or poor treat view safe","97","29"
"1187","Base lay charge environmental","442.18","false","appliances","Party production ready allow community benefit under player just","65","34"
"1188","Specific together","406.02","true","food","Protect air board entire member challenge hair resource risk although","70","17"
"1189","Case situation money culture","355.47","false","random","Reveal quickly cover entire ball account thousand evening","16","77"
"1190","Live red reality ahead we","11.89","true","random","Family she mind compare positive white second bank maybe up run item early degree hard here","100","17"
"1191","Music think address Congress","54.62","true","clothes","Student boy significant Republican finally entire significant fear hard tough save guy unit whatever","38","23"
"1192","Way get expert true","396.87","true","sports","Off while office feeling back democratic young fight hundred","76","91"
"1193","Forget low hold radio involve","106.52","true","sports","Of on difference view mind individual leg suffer but board every","63","68"
"1194","Book today style method several","344.05","false","clothes","Successful time set see local lot music house they because though power yes nature executive price","9","45"
"1195","Plant blood","310.62","true","appliances","Most she drug serve five only tonight cost strong avoid","72","85"
"1196","Number choice article","197.35","false","sports","Realize report minute street even shoulder feeling activity pass recent recognize score card must","79","41"
"1197","If onto fish","362.31","true","sports","Key participant already marriage magazine cultural cut attorney","6","78"
"1198","Late difference middle land","244.13","false","food","Hit despite discover which argue car believe everybody civil what","35","41"
"1199","Professional shoulder everybody moment","311.19","true","clothes","Prepare number go investment order can official company little event effect write","96","91"
"1200","Knowledge among player really police","320.26","false","sports","No evidence program offer table cover truth","11","53"
"1201","Way mission style hour","266.09","false","clothes","Staff ball let side bring less put research","59","49"
"1202","Kid life such","381.92","false","clothes","Friend bag more television box guy program","14","83"
"1203","Knowledge remember tough produce","461.67","true","appliances","Fine so toward color feeling Mr crime price","73","89"
"1204","Boy camera owner or notice","19.27","false","sports","Call cost number pick available argue same","60","8"
"1205","Heavy resource term during under","407.92","false","food","Boy condition Mr individual market week building reason knowledge home","1","17"
"1206","Share leader staff","86.89","true","appliances","Thing himself fire evening with various work strategy relationship serious","43","8"
"1207","Physical trip southern event question","249.33","true","random","Less another believe night surface degree add treatment","51","18"
"1208","Fly gas role","195.86","false","food","Thank front suggest forward blood around stand medical arm state threat measure stock","87","51"
"1209","Factor them law","469.35","true","sports","During million find condition six member model sing mouth pull such","61","30"
"1210","Play ability enjoy enter window","143.84","true","clothes","Church owner cut president bit reveal including","19","13"
"1211","Car across interest","281.25","true","random","Technology last would suggest former no force long car grow central produce have matter parent","75","80"
"1212","Avoid teacher card whatever more","264.06","false","appliances","Community provide against recently model close create quickly","73","77"
"1213","Can paper although break of","228.84","true","appliances","Common say relationship eight ever half act move edge decide one soon cell address might","14","61"
"1214","About account data","141.48","false","clothes","Trial federal throughout very cause listen science thing some dream near","77","83"
"1215","Heart source market","496.93","true","random","Development everything book paper number plan while continue weight kid religious half law","76","87"
"1216","Product top friend","487.58","true","sports","Range apply few act long growth fine it world piece remain break support now everything","37","25"
"1217","Reality could life thus difficult","237.12","true","sports","Appear mind father and establish story wife last certainly statement development section perform green far","58","42"
"1218","Catch factor Mr","232.41","true","clothes","There as attorney and line dog look ago agency","16","59"
"1219","Pretty against","13.85","false","sports","Discussion federal fight in set either say personal girl vote star national notice","23","65"
"1220","Race million end","58.59","true","clothes","Family short hour detail suffer prevent seven detail small computer thing air travel home live","42","3"
"1221","Blood enjoy could","417.82","true","random","Physical three our bag behavior likely student save guy chance sing rather scientist","33","10"
"1222","Try address window become","240.94","true","appliances","Central indicate foot weight any well class window start","92","84"
"1223","Person economy","30.84","true","random","This face despite before admit such market store discussion that","12","10"
"1224","Admit blue commercial","166.11","true","sports","Benefit magazine system decide remain room yeah","73","69"
"1225","That nothing second almost","87.32","true","random","Trip get beautiful serve foot travel since choice statement catch goal travel today study","36","33"
"1226","Why write","90.08","false","sports","Serve use someone company evidence itself must include their because everyone reality all where","11","83"
"1227","Stuff themselves","12.71","true","random","Rule various star clear describe find very event little question action its federal good call teach","96","63"
"1228","Free unit join call","153.70","true","random","Already cover officer discover oil agent enough front quickly individual community black trouble name","85","81"
"1229","Father religious democratic seven where","448.94","false","appliances","Protect watch conference follow hour rock eight wonder southern campaign kid","35","21"
"1230","Camera final call","90.39","false","clothes","Paper game western blood pressure where matter rise ready perform stop stock","67","27"
"1231","Possible majority Mrs green","177.25","true","food","Mission them last society just dog song into yourself understand court try","49","40"
"1232","Pretty total tend number","271.66","false","sports","Let contain price affect traditional simple full else family bar free great different social water","58","33"
"1233","Cause key thing increase arrive","404.64","true","food","Kind economic brother letter just involve agree","45","84"
"1234","Often of reflect","456.37","false","appliances","Body couple speech wrong include call wide","34","20"
"1235","Very way may left","64.00","true","sports","Huge defense policy serve tough kitchen follow medical home name personal place","6","58"
"1236","Fact name rate over add","375.06","true","sports","Arrive TV live relate indicate box approach","53","40"
"1237","Unit down page action sure","38.65","false","sports","Network put these truth call whatever way break he consumer themselves force","91","34"
"1238","Increase film bill","267.52","true","clothes","Claim movie need concern discover wait matter health probably piece analysis level","18","94"
"1239","A democratic worry","470.48","true","sports","Method whatever report scene trial subject occur hope thing help toward nearly base","79","3"
"1240","Character series","258.81","false","sports","Ten make Democrat describe nice sometimes job better","4","58"
"1241","Big prevent miss interest marriage","7.62","false","appliances","Continue section sign animal draw specific article friend","32","78"
"1242","Song party once","49.41","false","appliances","Beat hospital south civil live raise moment matter board thing happy mention share hear create","11","3"
"1243","Today ground research","124.49","true","appliances","Lead wear throughout keep position author change simply past light face recognize","76","78"
"1244","Green strong","237.27","false","random","Successful friend father return order share far","5","87"
"1245","Food star speak","304.30","false","clothes","Also mission administration clearly garden open person","67","81"
"1246","Responsibility color table like","117.12","false","random","Moment woman its product ago choice form through tax TV source at first ok","30","21"
"1247","Indeed find middle age","143.13","true","sports","Enter herself like change drive series professor source rock into military focus report can tonight enter","42","42"
"1248","Focus wrong low hot","488.71","false","food","Only paper series seat citizen smile kid ago bag beyond practice morning itself new explain","62","8"
"1249","Effort assume","496.57","true","food","Information gas determine difference product rather let cup","46","83"
"1250","Threat whom performance husband off","342.48","false","sports","Fight put such pay special less major draw example together court population also office her chance","16","68"
"1251","Develop quickly method marriage seat","295.17","false","sports","Care military back place none pass would","79","23"
"1252","Level success consider","239.61","true","random","Democratic many meeting across community enjoy good staff set arrive however or","19","55"
"1253","Concern same heavy describe","458.56","true","clothes","Visit join wish door person past fly who arm tree number lose respond","58","82"
"1254","Still whole think entire television","167.23","false","food","Protect mean resource establish other because fire explain available","30","85"
"1255","Policy class form recently north","101.46","true","sports","Yes meeting likely could finally than the because administration start garden","95","40"
"1256","Most time","192.99","false","food","Level example build former husband amount group never management family policy true possible set red their","31","13"
"1257","Establish same central order","97.43","true","food","Themselves role but everyone among smile identify least agreement easy recent","43","41"
"1258","Floor about","344.20","true","sports","Suffer force police dream blood order pick practice threat","42","18"
"1259","Treatment do","12.42","false","sports","Money company it stock protect best first far usually drug","96","77"
"1260","State five decade throw","29.05","false","sports","Heavy else short bank movement me whole different generation front several history head purpose case his","73","63"
"1261","Debate common season mother political","114.29","true","sports","Again now strong five attack prevent morning instead meet body leg whose relationship too size","6","20"
"1262","Never everything sound","68.27","true","sports","He blood data summer develop because plant","2","63"
"1263","Continue challenge what force","269.34","true","food","Might something term pressure including benefit make prepare third front outside above news","62","70"
"1264","Anyone full serve","270.09","false","clothes","Computer theory brother send option kid pay company film news their history today concern light","46","71"
"1265","Stay station","32.07","false","random","Heart data general team first remain TV black image open part happen share national","12","51"
"1266","Really cut occur my","144.89","true","random","Check standard enough country subject wish federal put","52","80"
"1267","Sort collection appear key","482.79","true","sports","Country firm up year pattern like though across responsibility former imagine life how challenge southern focus","38","61"
"1268","Keep economic bill result","308.28","false","food","Tonight theory mother go so evidence environmental arm deep institution particularly factor continue","11","59"
"1269","Sister baby color project who","391.19","false","clothes","Recent white history case miss third here trouble dog","6","35"
"1270","Especially some international","91.39","true","sports","Left rate option her accept talk everyone pretty agree second nation","7","58"
