"1449","Dream above act light its","285.68","true","appliances","Food too federal go nothing body who stand PM thus only bill later","90","78"
"1450","Right own show collection","325.32","false","food","Discussion network then senior policy interesting central need heart carry account along","79","58"
"1451","None late program","474.91","false","sports","Case wonder back box hotel budget fall most","11","50"
"1452","Heavy record rule special","109.66","false","random","Ask star herself provide beautiful difference report","35","66"
"1453","Central road according plan","487.84","false","random","Continue tend she remain direction occur training happen name action spend well protect author indeed","52","79"
"1454","Dream yeah report garden","215.41","true","appliances","Evidence yourself somebody light already development eat among change goal manager certainly must","86","13"
"1455","Left mention ago region","288.59","false","sports","Unit director bar American material style through evidence southern deep by sign human long air already","67","53"
"1456","Lead wide knowledge charge lead","276.95","true","clothes","Fear recently detail deal service agent already improve style","9","45"
"1457","Say if tough voice interesting","274.79","false","clothes","Old some process focus head mission number natural model future crime speak fill step","53","84"
"1458","Group top woman everyone quickly","347.62","true","appliances","Doctor especially today value become term identify five year else front than choice toward return","25","4"
"1459","Its open upon","201.71","true","clothes","Series shoulder specific offer language traditional region strong team staff next movie page","33","45"
"1460","Kitchen white four sometimes","312.32","false","sports","Interest perhaps almost probably least place community those suffer Congress gas black evidence have own would","12","49"
"1461","Interest accept","450.56","false","clothes","Research despite course that me security recently plan food me sense energy","10","87"
"1462","Economy whose same","267.29","false","random","Simply charge partner poor with far success often bring five enjoy","55","13"
"1463","Arrive market or yourself environmental","428.51","false","random","Different look down grow team whole director former table finish boy","57","68"
"1464","Very look bag smile","108.38","false","food","Order choice most group everybody image coach trip national add senior sound that operation","17","63"
"1465","Wall red protect simple other","373.02","false","sports","Box school despite suddenly drive particular whose avoid about kid of allow subject space now prepare","76","78"
"1466","Soon administration natural tell","494.16","false","food","Draw myself cup pass like finish many kitchen","89","71"
"1467","Keep their church","305.49","false","random","Cold as exist indicate experience item image expect senior movie add value season we yes seem","14","51"
"1468","Despite imagine husband our full","307.26","true","food","Camera start really benefit risk security article while the buy order begin future Mr","97","35"
"1469","Drug range account","366.16","true","random","Measure start chance development happen direction guy what little establish four sea candidate face material particularly","66","79"
"1470","Value growth medical up employee","22.88","false","sports","Newspaper season me walk offer source maintain","76","55"
"1471","Notice kid size","55.48","true","clothes","Plan such computer down many thus to voice","43","70"
"1472","Imagine seat friend","295.55","true","food","Four lose far down power reflect as soon able","60","82"
"1473","Smile crime model woman reveal","413.68","true","sports","Water guess million by community dog join brother live measure partner professor","56","61"
"1474","Thus expert near","308.91","false","clothes","Hear rock only lot government off discussion up power almost number","69","29"
"1475","Camera son book","422.89","false","clothes","Now happen head church card knowledge information bill kid before action receive must statement news indeed","10","61"
"1476","Southern point travel","471.63","true","food","Role else dinner message manager nature hand difference mouth poor than","28","56"
"1477","Whole available phone","267.62","false","random","Air action student interest sport purpose nice program according action probably despite anyone himself","73","2"
"1478","However bank make","126.54","true","clothes","Go too newspaper result resource serve contain available almost sometimes front charge","55","34"
"1479","Cup question degree glass","39.56","false","random","Certain special party major number blue third head full agency water","63","8"
"1480","If policy wear would girl","37.44","false","sports","Note picture very development get process key ago these list cost little close part talk","7","30"
"1481","Off young have","282.93","true","clothes","Through word help friend pull avoid military rich though lose dream quality management decision focus remain","9","2"
"1482","Collection staff","223.33","false","sports","Figure after price region another wide country center leg itself beyond prepare put grow visit suddenly","56","70"
"1483","Cause number fill manage","281.25","true","random","During power term ten receive practice bag plant nearly","5","3"
"1484","Respond recently nation space","311.75","false","food","Candidate suddenly really modern crime building least somebody","9","36"
"1485","Dark add near public without","394.51","false","food","Avoid month little certainly couple choose wish add natural camera bring traditional mean style","16","6"
"1486","Including agent","138.51","false","clothes","View ever win often exactly strong act once fish adult then","57","69"
"1487","Take third two","399.60","false","random","Build deep tree arrive blue one herself six since she rest anything one","72","33"
"1488","Season war experience Republican author","300.48","false","random","Trouble finally decade amount cultural as herself there","79","40"
"1489","Big charge seem","470.18","true","random","Hold purpose walk member around child system investment together dog man general defense situation according adult","94","23"
"1490","Herself soldier standard","39.72","true","food","Save drug start win sing only media impact car subject guess teacher","89","78"
"1491","Church though able tend","75.42","false","random","Live full fly available sit behavior stay painting economic course source","42","70"
"1492","Establish color agree floor","218.17","false","random","Any get her generation better white card where every day forward wife president","21","64"
"1493","Year natural require create technology","433.94","false","food","Turn collection individual provide author until position best blood gas evening item","72","29"
"1494","Whether condition","275.31","true","sports","Test again travel pass performance much science according former away near remember fly why popular","20","20"
"1495","Four it let","386.83","false","clothes","Against prepare economy focus society actually and morning south member thing","36","8"
"1496","Energy win","143.63","true","appliances","Sure establish light kitchen thing dog gun","23","18"
"1497","Give because fund activity","411.72","false","clothes","Himself economy vote make person heavy serious bad run church environment huge in easy exactly","74","53"
"1498","Service east have","432.77","true","clothes","Most audience same to high wrong bill near scene rest","46","40"
"1499","Sing remember far provide best","252.75","false","clothes","Tend play his child take teacher dark drive beautiful voice little","50","64"
"1500","Somebody move bar Mr room","482.91","false","sports","Science finish determine thus entire account under everyone main forward ever get plant","5","58"
"1501","Then today information marriage","417.16","false","clothes","Hotel mention charge bank agree you field world rich foot despite similar finish","34","41"
"1502","Catch most between","97.17","true","food","Enter camera determine serve possible short mind dog talk matter building require cultural","36","97"
"1503","Sea good raise certain","111.03","false","random","End material southern late again more around already by my science pick during","40","4"
"1504","Rock enjoy on yeah movie","278.77","true","food","Yard this stop visit child painting develop relationship commercial role military brother","30","61"
"1505","Reflect thing decision remember","82.80","false","clothes","Culture open task side who Congress election type","41","89"
"1506","Discussion instead discussion","88.34","true","clothes","Wait fact market drive school give top bed group","27","57"
"1507","Trial cause Mrs those","257.57","false","appliances","Any year future process base but matter see produce my always western meet","23","87"
"1508","Well relate senior thousand","97.22","false","clothes","Force civil she over while dream law cut live","85","82"
"1509","Not piece alone wish","247.03","false","random","Reflect prevent soon should base professional continue dog evening magazine near piece lose experience argue painting","11","79"
"1510","Oil necessary field","351.48","true","sports","Rather population fish medical chair matter unit own","58","58"
"1511","Necessary prevent","402.30","false","food","Eye law major gun blue health marriage life discuss environment radio leader","30","87"
"1512","Camera customer else foreign","201.99","false","food","Summer last wonder marriage follow over keep establish experience successful there once arrive","46","36"
"1513","Manage begin","340.99","false","sports","Continue bed large fish age second any buy investment country hand support choice final several team","9","51"
"1514","Place study agency arm","23.46","true","sports","Listen again their serious although sing create society several family future painting future argue deep around","28","57"
"1515","Keep center trip pretty travel","278.58","true","appliances","Address at instead history meeting prove low","17","70"
"1516","Admit Mrs","192.24","false","sports","Season car receive at nice visit glass try also trouble under until democratic","33","42"
"1517","Provide health","391.74","false","food","Party all box assume law concern create either house such","91","17"
"1518","Say street owner most","122.03","false","clothes","Affect enough hard off international step her yeah home tax world upon","8","82"
"1519","Challenge deal","145.94","true","random","Prepare bank north red care different social pay claim pretty pick attack detail","42","30"
"1520","Everybody particularly political executive","70.12","false","food","Trip black window all situation plant less fight affect","59","85"
"1521","Memory be","182.87","true","random","Themselves skin just site room able scene clearly method hit","58","27"
"1522","Speech though","58.85","true","random","Hotel into read star these serious owner person brother","62","68"
"1523","Agent enjoy activity","454.62","true","clothes","Realize later concern crime tell green able in young rise leave foreign special live","73","23"
"1524","Market food","358.50","false","food","Gun arrive situation option bar sing drive meeting likely thousand sure him foreign line can","88","50"
"1525","Stay less","61.76","true","sports","Administration order water responsibility that science customer raise hospital size help bank","46","12"
"1526","Join especially land evening almost","174.39","false","sports","More smile its how down page marriage authority huge various walk say surface","18","50"
"1527","Policy art political","312.71","true","sports","Article everybody chair him tend can dream share focus price","92","55"
"1528","Since those too","262.66","false","clothes","Short car decide consider ten town trade then scientist career imagine apply we family very","52","58"
"1529","Media since agency officer","229.97","false","random","Course though may heart decision discover once physical child late today discussion pattern case","86","59"
"1530","Surface crime officer heart","470.33","true","sports","Team out another certainly house rate main place along shoulder service determine","81","65"
"1531","Bed none special check occur","211.14","true","sports","Practice way listen she music need however brother learn","23","48"
"1532","History will","93.33","true","food","Look my civil sign newspaper itself by pressure write computer every attorney","2","84"
"1533","Outside guy seek which develop","233.49","true","food","Peace last write price yourself where party item size","47","70"
"1534","Training might behind single capital","72.55","true","clothes","Machine trouble people especially cell reveal church","50","42"
"1535","Budget become leg animal","62.54","true","sports","Door order build road southern now international cause growth cause bank possible born necessary rise","90","40"
"1536","Leg help rock turn","215.77","true","sports","Turn approach take arrive more have response early ago give kitchen page star none page trade","10","79"
"1537","Organization song level","462.17","false","sports","His learn section rich international with project everyone finally","84","83"
"1538","Member fact blood","73.47","false","clothes","Area class wait contain college land truth up simple government","2","20"
"1539","Determine identify charge operation responsibility","264.22","true","food","Expert plant shoulder rock news top hair allow weight customer memory exactly","94","48"
"1540","House collection against not","326.23","false","sports","Represent interview us go marriage page study usually despite","81","13"
"1541","Baby shoulder individual","195.92","false","random","Recognize east close interview similar particular red finally sell only series guess upon nice administration","11","4"
"1542","Meet whom development","430.78","true","random","Back nation have quickly to trial star","79","36"
"1543","Raise line building","404.00","false","food","By condition assume different listen seat sell go author training action drug end player step","30","68"
"1544","Set recognize","445.29","true","sports","Keep visit majority quickly land series other","49","2"
"1545","Candidate section better","64.43","false","clothes","Year explain lay analysis should different today employee condition general social factor morning","45","79"
"1546","Into read avoid but claim","336.79","false","clothes","Boy marriage time appear according particular attention rise","84","66"
"1547","Long enjoy character simple","58.97","false","sports","Capital sport which most party answer machine artist sit","63","87"
"1548","Loss arrive","500.41","true","random","Hair community follow short to eat soon leave community avoid personal fine","3","28"
"1549","News third radio various","355.62","false","random","Child generation effort produce best reason effect water","76","40"
"1550","Image foreign mean gas not","316.89","false","food","Cell edge light anyone international individual Democrat","36","45"
"1551","Themselves two treatment onto staff","120.09","false","clothes","Sure live arrive painting yeah nor authority","89","78"
"1552","Necessary chance because society","103.86","false","food","Religious mission author data only memory force language","58","27"
"1553","Collection fire cause","19.49","true","appliances","Compare large son should order own reduce big agent here","23","97"
"1554","Because best company with","280.07","true","appliances","Pick magazine mother school instead get single radio though over","100","49"
"1555","Move significant region let","87.01","false","sports","What half national reflect situation event record require agreement him","30","68"
"1556","Gun nature","427.87","false","clothes","Protect read hold right may without explain game likely feeling above treat member","14","8"
"1557","Father act","53.50","true","appliances","Sing lawyer response shake machine baby then benefit plan however talk push unit debate coach","6","36"
"1558","Middle day","391.91","false","food","So benefit gun start wrong might tell property fast crime economy throughout all","30","87"
"1559","Leave under nothing usually","310.05","false","sports","Management drop exist dark key go instead trial appear","44","83"
"1560","Then organization","478.70","true","sports","Live brother people western win impact pressure staff entire be respond might realize writer purpose property","39","85"
"1561","Offer we page","479.58","false","appliances","Upon debate thousand determine popular them bill citizen eat ground way note if financial support radio","60","69"
"1562","Provide job look cultural remain","37.61","false","random","Each power industry not kid understand force attorney car","91","27"
"1563","Agent sometimes human","175.68","false","sports","Music team all determine standard effect piece state some relate case require turn commercial","58","84"
"1564","Agent out","274.23","true","clothes","Be ever because time sell front capital continue store police house future record population decide","73","20"
"1565","Field perhaps sit","345.97","true","clothes","Chance scientist consider upon success now explain source culture space","98","21"
"1566","Law note","52.18","false","clothes","Show significant right stock industry leave happy enough poor our rise get teach he chance","40","6"
"1567","Animal size increase unit without","489.42","false","food","Finish significant training serve past recently bag return daughter","52","53"
"1568","Start four item","450.45","false","food","State any plant get attack campaign special major manage home stay debate big together wind try","19","56"
"1569","Green staff right stage full","28.12","true","sports","Change must authority girl arm card power great American","7","17"
"1570","Including food off democratic","28.14","true","food","Series fall everything least really stay evidence southern writer animal recent page explain follow season","31","68"
"1571","Perhaps their top","68.61","true","random","Suggest difficult anyone consider around defense way include want idea","32","23"
"1572","Allow certainly by cultural","463.23","false","sports","Activity him but check role across western seek big form","71","27"
"1573","Later manager","330.32","true","clothes","Difference heart industry name both way my get condition write safe child bank administration","34","69"
"1574","Bank individual situation ahead sister","471.19","true","sports","Would door along hold experience free pay fine full as allow smile","20","91"
"1575","Training capital administration","75.59","true","clothes","Health understand training throughout wonder seat call week condition place teach save","36","40"
"1576","Study the record city","221.97","false","random","How administration reflect election answer color want possible keep crime Republican television","77","89"
"1577","Full teacher strong among financial","436.95","true","food","Ball than along those rest dog hear quite soon or for prevent new parent stock someone","41","3"
"1578","Culture father might evening image","403.42","false","appliances","Them film choose second return because together color source into","2","12"
"1579","Lay voice medical","466.70","false","appliances","Agree last gun fact peace out call western machine risk painting myself out across final","75","33"
"1580","Kind detail decade fire","284.06","true","random","I account personal back short resource as national","69","85"
"1581","Chance leave","341.13","false","food","President rich modern beyond issue tend tend allow account","24","84"
"1582","Many enjoy remember plant from","12.90","false","random","Agent throw the in lead else weight book","14","81"
"1583","Writer ability item","133.91","false","food","Learn face teach participant feel rather daughter officer operation pretty address value","23","6"
"1584","Sometimes lawyer according ask","85.27","true","random","Accept seven court sense very agency shake article Republican break training artist occur third artist","35","28"
"1585","Including practice","389.41","false","food","Person agency kitchen social thank might interesting despite yet","28","61"
"1586","Hair she authority believe","128.79","false","sports","Open remember you investment one next baby hope class like remain increase environmental road hair","81","68"
"1587","Agent them especially guess","414.70","false","sports","Small first local student traditional glass ago voice low","29","68"
"1588","Resource spring","279.72","true","appliances","True free hard hour onto position notice cover manager year speech clear project foreign big","26","82"
"1589","Relationship Mrs record","495.54","true","sports","Consider rock foreign voice situation chance mouth compare whether sometimes guy before","97","55"
"1590","Street discover choice our pull","1.35","true","food","Window skill must before true structure condition base sea medical pay but like","42","64"
"1591","Hotel mind program wall sure","86.98","true","clothes","Audience Mrs moment two finally expect eat will various eat","32","34"
"1592","Seek goal only","317.06","false","sports","Will green design choice house whose ball","99","97"
"1593","Lose research travel fly","282.76","true","random","Wife defense administration response him matter station number old child bar floor eight can upon customer","4","81"
"1594","Leg central other","294.19","true","food","Boy least energy attention star fast ten wife get attention he almost final real","100","69"
"1595","Create catch young may","267.24","true","appliances","Despite artist action trial how each sing herself my build","48","66"
"1596","Budget chair technology","346.66","true","random","Actually often them television information science short safe","11","89"
"1597","Would note","178.10","false","food","Thought sure here prove oil gun middle responsibility everything according theory collection eight produce sign","32","45"
"1598","Turn project yourself","262.51","true","appliances","Plant face experience right every hand major would table why agree herself question","13","89"
"1599","Region parent woman perhaps","439.78","false","sports","Name information drop husband language conference raise perform her economy firm information","57","21"
"1600","Morning again very","71.01","false","clothes","Pm role participant want provide will member","97","59"
"1601","Summer establish to dog","173.39","true","food","Me line tend newspaper color prepare job character focus it","96","71"
"1602","Newspaper television","25.00","true","sports","Sit full before experience find alone six reach","16","53"
"1603","Each create science science final","32.39","false","sports","City clearly marriage house media whatever after news actually think possible against","70","40"
"1604","Party son million well low","204.32","true","sports","Same because risk light wait agency born site three nature these share respond upon thousand","19","35"
"1605","Listen nation theory","92.40","true","random","Western against civil likely create number mother morning may kitchen itself fall left end experience expert","88","41"
"1606","Our trial summer section","345.63","false","clothes","Despite least save yard pick your bar","32","81"
"1607","Enjoy national trial at cover","383.13","true","appliances","For me lay Democrat color difference need remember among","16","57"
"1608","Still really","190.36","false","food","Clear certainly lawyer argue they especially character interview company sea news organization method","59","35"
"1609","Account change similar","444.25","false","sports","Ago past put blue toward along energy war third glass leave large","87","57"
"1610","Republican get campaign step","44.40","false","clothes","Stuff her majority majority often participant however expert necessary kind best source hit company occur former","4","36"
"1611","Wrong instead process behavior financial","76.70","false","food","Among no find set trouble watch fine I subject would seek investment since or","31","65"
"1612","Fall safe red","390.69","false","clothes","Again with trip consider successful particular both away within kind about next such detail language","51","71"
"1613","Factor establish central vote","110.49","true","sports","His home left short culture movement until current performance allow one draw forward student lot","37","50"
"1614","Today possible employee product","241.11","true","appliances","Step military why itself box college professional current smile identify worker direction situation speech","80","59"
"1615","Civil mind","436.14","true","clothes","Able table during pay own travel street suggest measure","55","64"
"1616","Son almost tree","349.32","false","random","Manager way newspaper rest occur open standard minute method organization","100","58"
"1617","Subject provide subject","220.55","true","sports","Remain together data us create professional week defense later spend","75","58"
"1618","Sort some ago determine economy","439.24","true","appliances","Interview mission off get president relationship group raise fear","59","23"
"1619","Structure main force","364.49","false","clothes","Majority chair benefit enter trade respond real civil suggest woman send to","25","40"
"1620","Million career senior","205.75","true","random","Late customer sort board as whom stand leader opportunity night enjoy least","2","17"
"1621","Region yeah we","390.39","true","food","Behind commercial option but much civil they political three then","22","64"
"1622","Early national air already street","374.03","false","appliances","By school music red career stop night at office front past themselves form","64","79"
"1623","Truth your","392.12","false","sports","But community sister suffer attorney become everybody put exactly lawyer dark","43","41"
"1624","Day week type we","253.22","false","clothes","Require whole into spend half produce rest","10","12"
"1625","Foreign the green go","443.00","true","clothes","Figure term case nature plan speech think also couple plant respond","18","55"
