"0","Thank least story expect","97.94","false","food","Nature what avoid task join land natural discussion expect attack south check yard","41","77"
"1","Tax sort end score","469.38","true","food","Fund rest relate actually treat goal affect himself past suddenly increase","71","3"
"2","President cold family","302.77","true","random","Feeling activity own few service structure sell sense well practice letter TV","50","61"
"3","Since lot message","433.22","true","food","Only adult wife enough physical vote method usually president question world data effort occur note","28","91"
"4","Piece line space","430.27","true","random","Shake suddenly should rise edge particularly safe guess hard base whose","72","49"
"5","Boy prove","200.93","false","random","Always huge total everything discover hot right never popular city require relate term have yet","21","2"
"6","Social rate base","497.94","true","random","Pretty behavior book machine indeed only stop force offer hot computer power raise","44","28"
"7","Bill person TV","256.68","true","random","Rate young since public technology stop address should individual save sport sound thank Mrs","2","34"
"8","Country include good Mrs","196.85","true","food","Visit reduce interview time which north far practice law wish together","37","10"
"9","Before machine","6.73","true","sports","Business among cultural center while north can yeah project office security significant","63","13"
"10","Even direction police","408.34","false","appliances","Admit Republican federal compare movie eye play forget human teach","68","23"
"11","Box sometimes degree consider thus","313.72","false","food","No case democratic work opportunity such true major line fish","33","83"
"12","Body poor high kid big","490.57","false","sports","Store probably individual easy poor girl quite break they thing","63","17"
"13","Why up memory drug","372.36","false","appliances","Standard situation worry gun small thought cause","84","49"
"14","Budget us","150.01","false","random","Wish old animal there trip consider east then","32","34"
"15","Event thus worry say","74.70","false","appliances","Will share fish meeting item during policy agency however around want station wife spend","96","50"
"16","Prove recently stuff participant","461.27","true","random","Million already billion magazine various lay appear offer important","72","33"
"17","Brother step provide look","366.30","false","appliances","Themselves have professional yes just positive within tough step color follow off fine","6","4"
"18","In choose treatment","199.99","true","appliances","Treat yet western thousand good if water agent make travel","37","61"
"19","Window scene the","68.60","true","sports","Second order close structure recent woman opportunity color you book fall manage weight since same","44","85"
"20","Year oil","72.88","false","appliances","Important mean almost because job power from not beyond","47","57"
"21","Strategy establish again ahead","211.78","true","random","Network perhaps after force pass six surface standard despite","88","78"
"22","Soon well must already","450.46","true","appliances","Director beat reduce responsibility news knowledge employee institution end fact ready coach this forget","19","81"
"23","See serve successful line","120.25","false","clothes","Determine within fund behind year fact lay success clearly wear right","5","72"
"24","Debate police agency hope","88.70","false","food","Meeting visit service course Mr including perform use trip recognize add ok","68","81"
"25","Build firm","56.82","false","sports","Care plant happy else at woman politics","28","87"
"26","Man who meeting","255.20","true","food","Book sit she although country relationship bit safe production form television true","71","80"
"27","Any purpose newspaper","64.09","true","clothes","Win way guy grow detail successful understand recent","78","79"
"28","Argue painting bed","275.96","false","clothes","Either oil beyond indeed street number pull mother carry painting nature world mention whole with","13","66"
"29","Church care easy view how","367.70","true","food","Future several former face office system present fast","9","25"
"30","Stage two region number both","271.16","false","sports","Nation position contain meeting life stuff new in ago any","39","77"
"31","Everybody onto sing nearly","150.84","false","sports","Field dinner who wind recognize remember during owner check attorney","33","84"
"32","Before century","358.76","true","random","Program share agree memory voice off I time five","38","2"
"33","Stock area","10.00","true","random","Every oil music fast picture through really age big reality somebody indicate Democrat game tax","24","59"
"34","Throughout dinner statement","36.69","false","appliances","Information glass activity behavior eye someone car pick above relate probably","59","20"
"35","Seat collection face stuff","65.41","true","food","Range heavy tax hundred magazine measure computer modern increase me item many ready according","1","85"
"36","Nothing easy key","472.23","false","random","Upon serve significant choose serious experience country mission argue","2","12"
"37","The raise much nature scene","218.72","false","appliances","Leave knowledge toward former thousand TV build unit option","52","10"
"38","Institution tonight act base suddenly","434.15","false","sports","Happy PM finally dream eight run bring either stay public experience","25","48"
"39","Take certainly specific various it","267.69","false","food","Grow try history south all usually growth","27","45"
"40","Raise put total inside","473.32","false","clothes","Out offer military people box both fast responsibility home ability","24","53"
"41","History real skin already","113.21","true","sports","Next game add visit upon value recent","7","20"
"42","Range ask friend","375.00","false","clothes","Protect hold type might four heavy movement way however old just note walk interview second rather","81","55"
"43","Discuss stuff those provide two","51.71","true","appliances","Amount billion image mother clear couple according professional bank deal","28","49"
"44","Themselves open","192.11","false","clothes","Race customer local side necessary way scene on new write most left hundred still per","12","33"
"45","People social receive travel friend","448.59","false","random","The push notice easy TV feeling rate","76","66"
"46","Mind not talk drug","214.59","false","sports","Nature reduce human general low ever federal with notice boy sign themselves","24","87"
"47","Win kid","97.54","false","sports","Behavior street learn who watch room every film exactly side necessary chance will","77","94"
"48","Tonight great","493.20","true","clothes","Fill might him indeed student finish family family","82","55"
"49","His sister suddenly","285.58","false","appliances","Wrong final though material dark responsibility often animal wife maybe of apply understand available","29","27"
"50","Per husband provide social","486.62","true","sports","Month light I have six investment husband Republican","43","69"
"51","Tell tax scientist task","300.58","true","clothes","Some eat yard too general though statement just or fine move particularly purpose low since","29","42"
"52","Girl age audience policy","21.21","true","random","Quite if bill base store cold affect woman down","18","94"
"53","Identify between executive amount","314.93","false","sports","Political baby nation hear several plant rise follow speak serious","91","21"
"54","To young catch me","411.67","true","food","Speech more central simple dream experience theory officer rather too reason","69","53"
"55","Recent of seat cause","139.47","false","clothes","Site decade affect feeling model others technology successful move design gas dark raise down","83","89"
"56","Human cost space","195.52","false","clothes","Bad either those education certainly action citizen mention finish simple others painting","22","51"
"57","Skin occur institution","178.03","true","food","Enter significant perform themselves image me agree decide","95","42"
"58","Development example question drop me","69.46","false","appliances","Section next in his tax hot media","67","77"
"59","Man yet scientist four west","192.63","true","random","Test feel project throw day economic body road","53","23"
"60","Sister career","115.73","true","food","Matter environment apply probably member nation open usually interesting discussion oil","81","97"
"61","Hotel leg consumer","37.78","true","clothes","Care reduce for to four size day alone owner that growth finally","11","25"
"62","Government some election develop","278.53","false","food","Woman future event quality store present kitchen I world never make interesting course early box","59","40"
"63","Specific consumer guess soon","21.24","true","food","Both north fly rich could various many sport alone of","85","64"
"64","Pay air bag I modern","459.76","true","sports","Social movie decade art movement college purpose miss realize out much Democrat","49","35"
"65","Development factor bill outside from","260.04","true","clothes","Range protect wife item hear allow local price teacher total improve","23","42"
"66","Early son food","132.38","false","random","Continue image fact card important anyone throw positive capital pay Democrat group allow control ability will","99","8"
"67","Nothing sound event spend","278.31","false","random","Run deep same whether full but create soon president ask","43","89"
"68","Center firm term","273.29","false","sports","Choice reach PM cultural response range identify event view director wear door","92","41"
"69","Able protect how best","22.07","false","appliances","Hold recently close often nice pick meeting major of democratic capital","58","40"
"70","Model let focus","203.58","false","appliances","Always special agency party around great better federal","62","30"
"71","Four police current","130.17","false","food","Board personal energy green may heart poor few radio interest put ball drop research usually","97","87"
"72","Side whole part indeed soon","117.48","true","clothes","Him director site bank arrive worry service old director such sing","24","30"
"73","Speech break","149.08","false","appliances","Candidate grow believe century still show sense cold indicate send yes reflect economy wait even else","68","82"
"74","Seven may threat","12.93","true","sports","Important all cut white oil about mention discover whose","54","80"
"75","Quite player world particular","465.11","false","appliances","Step its material owner establish human relationship effect everything government","78","27"
"76","Skin while rock","498.10","false","food","Couple exactly both similar allow rate including always far push","34","87"
"77","President level drug","40.22","false","random","Ten team grow piece identify at do manager attention away time","52","97"
"78","Great go manager drop","491.98","true","sports","Doctor camera explain less evidence mind skin individual","9","10"
"79","Network left could","152.81","false","appliances","Party alone keep team skin style force trade effect course begin apply specific","8","30"
"80","Dog decide daughter purpose light","310.88","false","clothes","And democratic yes environment together prevent mind","76","97"
"81","Condition food forget happy place","312.35","false","random","Policy town relate most buy friend anyone performance up evidence mind","61","80"
"82","How people various","457.15","true","sports","Purpose whole use right church executive pattern figure year talk compare","77","17"
"83","Participant fight man pay","61.24","false","clothes","Chance bar down light out economic third education notice","35","36"
"84","Effort former like agreement include","382.56","false","sports","Skin ready per political find them civil example third speech walk least charge","35","12"
"85","Himself central modern","325.25","true","clothes","Mrs film medical money act just wind film he perform right discover field prepare","99","81"
"86","Service blue so oil","418.21","false","clothes","Training simple sort business kind behind minute standard particular authority we behavior safe","24","41"
"87","Current camera final","109.15","true","sports","About eye piece total contain certain though body discuss","25","34"
"88","Must sit maintain feel","265.08","true","food","Man happy night within recent involve continue want answer century","59","58"
"89","Degree trial","165.39","true","sports","Sell magazine even PM body stand none wonder until","84","18"
"90","Pass commercial","350.25","true","appliances","Camera new fish production exist read clearly write life without wind thank impact miss into","49","34"
"91","Page across once station","33.65","true","sports","Alone her down good dream ability itself prove","36","97"
"92","Would take inside research her","34.64","false","appliances","Perform listen size resource record build account budget same","90","50"
"93","North federal establish stage","9.49","false","sports","Moment themselves international table make point will health travel management mean big wall structure","87","94"
"94","Nature drop sport really hair","434.46","false","random","Wish learn edge body nature reason medical sign step a party entire those","14","94"
"95","Task true light fall","176.88","true","food","Condition away make deep father suddenly try new street line usually until hit unit skill far","22","30"
"96","Increase according drug","495.41","true","sports","Wife computer common those social your record avoid history time person large explain fill too","19","68"
"97","Play hard could","199.97","true","food","Break painting budget Congress care medical common involve his seven strong decade control","43","21"
"98","Model carry front","186.98","false","sports","Central once pull term attention trade rest budget away trouble evening","20","4"
"99","Police every management difficult","213.74","true","sports","Total sound experience sit analysis result seven group think","24","63"
"100","Third never","385.61","false","random","Suddenly travel while much others north home describe","60","58"
"101","Impact company church","280.18","true","clothes","Wide senior actually director large blood stay happen","92","66"
"102","Score kitchen daughter","20.58","false","appliances","Another indicate occur with second seek treat team study late certainly itself better key","46","30"
"103","Fill bit local through stuff","276.82","true","clothes","Walk attention expect similar must glass response Congress thank peace attack every can","9","48"
"104","Effort find cultural with","471.19","true","food","Though rich manage book catch which minute","52","20"
"105","Choice summer action","14.94","true","food","Long maybe number think goal radio throughout population black represent wall fire while","17","33"
"106","Live though network movement","348.55","false","clothes","Project outside behind his risk too feel everything whom","81","71"
"107","Standard control number","406.62","true","appliances","Her position particularly black big turn table eight Republican","7","17"
"108","Management shake various good","206.71","true","sports","Moment reality offer two early energy pick return civil rule alone name program fight yard short","82","23"
"109","Herself open become every although","197.48","false","clothes","Media key least performance provide woman over behavior even","28","58"
"110","Single behind nearly","26.73","true","clothes","Very offer speak her human weight significant feeling deep experience call treatment dream thought recognize size","10","80"
"111","Live claim option","114.81","false","random","Will other describe organization third late interesting commercial thousand same research maybe pull upon offer write","31","77"
"112","Chair speech","217.15","false","appliances","Seek mention four religious bag mouth capital surface quite seat lot behavior movement","52","12"
"113","Network little along staff behavior","116.50","false","random","Author democratic section agree then like about factor example then economic seven","21","69"
"114","Several magazine sign act outside","462.83","false","sports","Happen worry choose market thousand low way president thought investment contain role until truth","95","66"
"115","Surface add age","500.10","true","food","Control foot present money size improve note our song","73","65"
"116","Wait according","66.53","false","sports","Scene hospital president establish argue television or require","34","28"
"117","Attack would you service","18.04","true","appliances","World join model usually lawyer reach later surface","3","63"
"118","Month report season","351.86","false","sports","Any none foot affect issue campaign one leader space world individual","51","56"
"119","Many rich perform north shoulder","45.03","false","sports","Chance subject majority year either career where now skill","78","42"
"120","Natural clearly remain","341.23","true","random","New for people wide live do security experience agency pretty measure goal push teacher attack","67","49"
"121","Here detail then sure","348.41","true","random","Town guy them different dream wind time let notice describe","75","25"
"122","Between loss goal sea","384.02","true","sports","Trial southern west hit take where perform idea your shake","55","57"
"123","What show Democrat","364.57","false","random","Continue break where may growth quite tough dark","94","45"
"124","Whose past","486.48","false","appliances","Serve better trade should claim pretty side ask art","38","58"
"125","Police news information physical","18.15","false","appliances","Address edge lead pretty protect star field everything very management add light day","12","71"
"126","International school","24.24","false","food","Who performance finish education investment south send entire oil research base produce artist yet","84","83"
"127","Once stuff somebody need","414.44","true","appliances","Collection attention hand old eat girl line program sense remain","14","41"
"128","Reality box scene laugh from","48.37","false","clothes","Offer maybe meet bit lead later let pull case","36","13"
"129","Chair treatment hold bar wife","268.87","true","food","Idea sign including into charge whole lawyer daughter store study light try","68","94"
"130","With above goal idea","376.99","false","food","Reflect he ago year forward far employee skin bank approach discuss","65","4"
"131","Room interest","128.42","false","appliances","Rule reality happen probably address threat figure discover project can white miss","87","82"
"132","Space store party surface story","247.10","true","appliances","Pm center whether model step old relationship service","9","51"
"133","New yes question stock","71.99","true","clothes","Defense would until exist street Democrat his same pattern professor","88","36"
"134","First laugh stock","315.43","true","appliances","Shake will season people deal fund that admit wind sport draw suffer behind improve","73","85"
"135","Store more","15.52","true","food","Land song morning beat population conference over also charge leg laugh realize","16","68"
"136","Budget term positive","302.44","false","sports","Under party since sea order make left candidate quickly product surface pressure any church hear","76","34"
"137","Attack never try","339.68","false","food","Stay little three southern but keep near message risk national pass several home figure","47","68"
"138","Industry over perform daughter organization","420.46","true","random","Present building require start professional clearly take","96","2"
"139","Once will","97.04","true","clothes","All ask analysis front free anyone president explain town","78","21"
"140","Responsibility deep apply gas hold","335.32","false","appliances","Indicate nation president leave particular strong low election","48","56"
"141","Consider husband let huge","116.97","false","random","Who Republican statement worry necessary worry huge gas finally","50","18"
"142","Son actually","174.21","true","food","Seek give PM size into together goal need","98","2"
"143","View around above argue black","65.25","false","clothes","Tv impact someone mother matter billion popular including power thought","13","56"
"144","Fact visit oil","281.57","false","sports","Save movement north word none trial focus serve order improve age","80","55"
"145","Hear religious trade","200.43","false","appliances","Color base that child political former other laugh enjoy decide billion Mr family simply speak","79","91"
"146","See through","364.89","false","appliances","Area west size interesting development option himself development any","50","4"
"147","Must cup","140.86","false","random","Person would rule pay TV hear myself that","85","78"
"148","Particular reduce month decade","482.21","true","sports","As difference pattern realize language notice board too hair model arrive hospital of community","36","81"
"149","Type minute seek make require","125.82","true","appliances","Appear green power Congress should head wind structure fill be final seat purpose","37","78"
"150","Mind leave","200.45","true","appliances","Cultural time president life field well six field police put decade us fear drive low","19","18"
"151","Debate they","402.49","true","random","Manage wall forget somebody rich fact wish center red education class range","27","41"
"152","Sense treatment within PM","317.73","true","sports","Help fill tree night entire skill professor expect change option before head","75","40"
"153","Member material citizen","129.03","true","random","Full his water fear book reality human","96","34"
"154","Top for treat blue though","484.88","true","clothes","I good recognize condition together material along military guess offer contain above full foot mention","30","57"
"155","Management research head","12.64","false","appliances","Summer own indicate life major across need lay recently compare indeed","54","8"
"156","Team place democratic","131.67","true","food","Some happen play mention focus expect record hundred person effort treatment","45","57"
"157","Fear enjoy whom us","354.45","false","random","Common sell building century determine draw board I gun hour push onto ready myself increase teach","15","77"
"158","People hear section","169.58","true","food","Available wait summer moment current traditional end offer rise something activity night executive one maintain","43","36"
"159","Quite type","303.41","true","sports","Wide appear area political forward nearly former hot","98","65"
"160","From industry west town born","405.77","false","random","Remember young decision shoulder which deal message worker matter","34","70"
"161","Interest son customer","58.65","false","clothes","Little option style approach officer country accept carry already whom of many take","28","77"
"162","Girl night","40.88","true","sports","Minute any nearly week decision executive training might why agent hospital must wrong happy character account","42","78"
"163","Such section","27.70","true","random","Fall on cold material push particular onto develop sport especially","45","25"
"164","Direction time those","399.63","false","clothes","Believe final sea me out concern anything room parent activity break medical property spend","28","42"
"165","Trial act how teach","15.01","true","random","Without have clearly structure class interest begin agreement positive although available population last inside anyone successful","24","80"
"166","Apply remember measure","46.68","false","clothes","His everything bill charge station nation mention civil technology view possible","72","94"
"167","Happy spring seek second still","316.03","false","food","Argue up two lead half cut not far per science its matter member state","64","59"
"168","Color explain strong","294.56","false","appliances","Learn begin coach yeah manager heart opportunity","25","97"
"169","Road commercial","224.97","true","random","Rock anyone fly for within describe leave per","30","36"
"170","Key hold rate","373.81","false","appliances","Off together fall keep why step long start person information talk deep","11","55"
"171","Where central live","270.29","true","random","Across personal data during red call unit response evidence defense red","74","23"
"172","Professional book firm","306.07","false","clothes","Thousand artist special minute spend herself page clear popular watch","78","29"
"173","Be mention truth attorney point","180.73","true","appliances","Never mean return down feel education everybody peace common pick party think next commercial one I","44","21"
"174","Onto prove argue plant","148.49","true","sports","Performance owner particular physical near few tell between beyond management can listen hundred step dinner","88","45"
"175","Theory suggest","38.28","false","random","Produce state moment product product blood federal both positive by","88","45"
"176","Human manager","198.97","true","sports","Once above subject yes career huge billion very customer road white which away interview","42","29"
"177","Leg above sign according national","302.12","true","clothes","Play few enough fast first east talk born break","87","83"
"178","Hit agreement prove","75.45","true","sports","Single administration soldier suddenly group again deep stuff I full big order down of","90","97"
"179","By should","190.18","false","sports","Suggest hundred knowledge lay trouble involve American thought go","67","51"
"180","Black various thank look","327.71","false","clothes","Run high high hit point thousand wife leave rest visit year","78","61"
"181","Against personal general exist","438.90","true","appliances","Everything foot service air organization hot want join term expert","58","33"
"182","Body long and current leader","8.85","true","clothes","Gun often by every people now reduce get rate suffer result television everyone check check to","90","18"
"183","Outside use","124.39","false","food","Bit process in attorney raise past upon owner","30","68"
